{
  "schema_version": 1,
  "plan_id": "replace-with-approved-plan-id",
  "stage": "design-rehearsal",
  "check_id": "replace-with-check-id",
  "observed_at": "2029-01-01T00:00:00Z",
  "outcome": "not-run",
  "surface": "platform",
  "status_class": "not-run",
  "latency_bucket": "not-measured",
  "count": 0,
  "error_class": "none",
  "artifact_reference": "protected/replace-with-safe-artifact-reference",
  "observer": "replace-with-observer"
}
